{
    "id": "chain-step-executor-gated",
    "description": "Like chain-step-executor but runs a small post-tool gate (prompt_to_int) after each tool round; non-zero score aborts the step. Optional; use contenox plan next --gate.",
    "tasks": [
        {
            "id": "plan_step_agent_loop_chat",
            "description": "Agentic loop — chat turn: model may request tools (transition tool-call) or finish this step (transition executed → end).",
            "handler": "chat_completion",
            "system_instruction": "You are the Contenox task engine for a single plan step — not a generic software engineer persona. You may use tools across multiple chat rounds until the step is done.\n\nSCOPE: Only registered hooks and tools exist (filesystem, shell, git, MCP, HTTP/OpenAPI as configured). There is no product UI, browser, or org workflow unless a tool provides it. If something requires a human-only action outside this runtime, say so briefly in your reply and finish with ===STEP_DONE=== without claiming the impossible work is done.\n\nREFUSE UNCLEAR STEPS: If the current step is ambiguous, under-specified, or cannot be verified with available tools, DO NOT guess and DO NOT take destructive or speculative action (no writes, no git mutations, no shell side effects). State briefly what is unclear and what input or prior artifact is missing, then output ===STEP_DONE=== so the plan can be replanned or clarified by the user.\n\nSame mechanism as interactive chat: call tools when needed, read tool results, then continue or finish.\n\nCONTEXT BUDGET: After each read_file, reply briefly (bullet notes per file: sections, tone, constraints)—do NOT paste entire files in assistant messages or repeat tool output. For large files use read_file_range. This keeps the run within model context.\n\nTOOL USAGE IS MANDATORY when commands or filesystem work is required.\nDO NOT just describe what you will do. CALL THE TOOL.\nWhen the step goal is achieved, output exactly:\n===STEP_DONE===",
            "execute_config": {
                "model": "{{var:model}}",
                "provider": "{{var:provider}}",
                "shift": true,
                "pass_clients_tools": true,
                "retry_policy": {
                    "max_attempts": 4,
                    "initial_backoff": "1s",
                    "max_backoff": "30s",
                    "jitter": 0.25,
                    "rate_limit_min_wait": "10s"
                },
                "compact_policy": {
                    "trigger_fraction": 0.85,
                    "keep_recent": 8,
                    "model": "{{var:compact_model}}",
                    "provider": "{{var:provider}}",
                    "max_failures": 3,
                    "min_replaced_messages": 4
                },
                "hooks": ["*", "!plan_manager"],
                "hook_policies": {
                    "local_shell": {
                        "_allowed_commands": "bash,sh,ls,cat,echo,pwd,which,find,grep,git,go,python,python3,pytest,node,npm,make,cargo,curl,wget,jq,touch,mkdir,rm,cp,mv,sed,awk,chmod",
                        "_denied_commands": "sudo,su,dd,mkfs,fdisk,parted,shred"
                    },
                    "local_fs": {
                        "_allowed_dir": ".",
                        "_max_read_bytes": "1048576",
                        "_max_output_bytes": "524288",
                        "_max_list_depth": "6",
                        "_max_grep_matches": "5000",
                        "_denied_path_substrings": "node_modules,.git/,dist/,/.next/,/out/,package-lock.json"
                    }
                }
            },
            "transition": {
                "on_failure": "",
                "branches": [
                    {
                        "operator": "equals",
                        "when": "tool-call",
                        "goto": "plan_step_agent_loop_tools"
                    },
                    {
                        "operator": "default",
                        "when": "",
                        "goto": "end"
                    }
                ]
            }
        },
        {
            "id": "plan_step_agent_loop_tools",
            "description": "Agentic loop — tool turn: run hook tools, then post-tool gate (not directly back to chat).",
            "handler": "execute_tool_calls",
            "input_var": "plan_step_agent_loop_chat",
            "transition": {
                "on_failure": "",
                "branches": [
                    {
                        "operator": "default",
                        "when": "",
                        "goto": "plan_step_gate"
                    }
                ]
            }
        },
        {
            "id": "plan_step_gate",
            "description": "Post-tool gate: 0 = continue to chat, non-zero = abort step",
            "handler": "prompt_to_int",
            "system_instruction": "You review the last message in the conversation (usually a tool result). Reply with a single integer only:\n- 0 = safe to continue the assistant loop (success or acceptable failure).\n- 7 = output looks corrupted (e.g. HTML/JS stream data), dangerously wrong, or unusable.\n- 3–6 = questionable; prefer aborting if unsure.\nNo other text.",
            "execute_config": {
                "model": "{{var:gate_model}}",
                "provider": "{{var:provider}}",
                "temperature": 0,
                "pass_clients_tools": false,
                "hooks": [],
                "retry_policy": {
                    "max_attempts": 3,
                    "initial_backoff": "500ms",
                    "max_backoff": "10s",
                    "jitter": 0.25,
                    "rate_limit_min_wait": "5s"
                }
            },
            "input_var": "plan_step_agent_loop_tools",
            "transition": {
                "on_failure": "",
                "branches": [
                    {
                        "operator": "equals",
                        "when": "0",
                        "goto": "plan_step_agent_loop_chat"
                    },
                    {
                        "operator": "default",
                        "when": "",
                        "goto": "plan_step_gate_fail_msg"
                    }
                ]
            }
        },
        {
            "id": "plan_step_gate_fail_msg",
            "description": "Static error string for raise_error after gate failure",
            "handler": "noop",
            "prompt_template": "post-tool gate: unsafe or corrupted tool output; refusing to continue this plan step",
            "transition": {
                "on_failure": "",
                "branches": [
                    {
                        "operator": "default",
                        "when": "",
                        "goto": "plan_step_gate_raise"
                    }
                ]
            }
        },
        {
            "id": "plan_step_gate_raise",
            "description": "Fail the executor subgraph with a clear error",
            "handler": "raise_error",
            "input_var": "plan_step_gate_fail_msg",
            "transition": {
                "on_failure": "",
                "branches": [
                    {
                        "operator": "default",
                        "when": "",
                        "goto": "end"
                    }
                ]
            }
        }
    ],
    "token_limit": 400000
}
