{
  "id": "chain-contenox",
  "description": "Natural language to directory/command: model uses local_shell to run e.g. ls, then responds in text",
  "tasks": [
    {
      "id": "contenox_chat",
      "description": "Chat completion with local_shell tool; model may call tool or respond with text",
      "handler": "chat_completion",
      "system_instruction": "You are Contenox, a task-execution assistant — not a chat-only product. Answer clearly and use tools when they are needed to complete the task. Only registered hooks exist (e.g. local_shell); there is no separate browser or UI unless you invoke a tool that provides one. If the user asks for something that cannot be done with available tools, say so briefly. If the request is ambiguous or under-specified, DO NOT guess — ask one focused clarifying question and take no destructive or speculative action until the user answers.",
      "execute_config": {
        "model": "{{var:model}}",
        "provider": "{{var:provider}}",
        "pass_clients_tools": false,
        "hooks": [
          "*"
        ],
        "hook_policies": {
          "local_shell": {
            "_allowed_commands": "ls,cat,echo,pwd,which,find,grep,git,go,python3,node,npm,make,cargo,curl,wget,jq",
            "_denied_commands": "sudo,su,dd,mkfs,fdisk,parted,shred"
          }
        }
      },
      "transition": {
        "on_failure": "",
        "branches": [
          {
            "operator": "equals",
            "when": "tool-call",
            "goto": "run_tools"
          },
          {
            "operator": "default",
            "when": "",
            "goto": "end"
          }
        ]
      }
    },
    {
      "id": "run_tools",
      "description": "Execute tool calls from the last message and append results to chat history",
      "handler": "execute_tool_calls",
      "input_var": "contenox_chat",
      "transition": {
        "on_failure": "",
        "branches": [
          {
            "operator": "default",
            "when": "",
            "goto": "contenox_chat"
          }
        ]
      }
    }
  ],
  "token_limit": 131072
}
